{
  "schemaVersion": "1.0.0",
  "baselineId": "AI_BASELINE_REPORT_v1",
  "frozenAt": "2026-07-11",
  "notes": "Empty measured series. Populate only via offline eval harness (Phase 4). Do not copy EvaluationService DEFAULT_METRICS into value fields.",
  "series": [
    {
      "metricId": "latency_p50_ms",
      "status": "not_measured",
      "unit": "ms",
      "direction": "lower_is_better",
      "promotionGate": { "operator": "<=", "threshold": 1200, "blocking": false },
      "value": null,
      "sampleSize": null,
      "measuredAt": null,
      "method": "offline_eval_runner",
      "datasetId": null
    },
    {
      "metricId": "latency_p95_ms",
      "status": "not_measured",
      "unit": "ms",
      "direction": "lower_is_better",
      "promotionGate": { "operator": "<=", "threshold": 3000, "blocking": false },
      "value": null,
      "sampleSize": null,
      "measuredAt": null,
      "method": "offline_eval_runner",
      "datasetId": null
    },
    {
      "metricId": "token_cost_usd_per_1k_requests",
      "status": "not_measured",
      "unit": "usd",
      "direction": "lower_is_better",
      "promotionGate": { "operator": "<=", "threshold": 50, "blocking": false },
      "value": null,
      "sampleSize": null,
      "measuredAt": null,
      "method": "offline_eval_runner",
      "datasetId": null
    },
    {
      "metricId": "retrieval_hit_rate",
      "status": "not_measured",
      "unit": "ratio",
      "direction": "higher_is_better",
      "promotionGate": { "operator": ">=", "threshold": 0.7, "blocking": true },
      "value": null,
      "sampleSize": null,
      "measuredAt": null,
      "method": "rag_gold_set",
      "datasetId": null
    },
    {
      "metricId": "retrieval_precision_at_k",
      "status": "not_measured",
      "unit": "ratio",
      "direction": "higher_is_better",
      "promotionGate": { "operator": ">=", "threshold": 0.85, "blocking": true },
      "value": null,
      "sampleSize": null,
      "measuredAt": null,
      "method": "rag_gold_set",
      "datasetId": null
    },
    {
      "metricId": "citation_presence_rate",
      "status": "not_measured",
      "unit": "ratio",
      "direction": "higher_is_better",
      "promotionGate": { "operator": ">=", "threshold": 0.95, "blocking": true },
      "value": null,
      "sampleSize": null,
      "measuredAt": null,
      "method": "clinical_response_contract",
      "datasetId": null
    },
    {
      "metricId": "citation_entailment_rate",
      "status": "not_measured",
      "unit": "ratio",
      "direction": "higher_is_better",
      "promotionGate": { "operator": ">=", "threshold": 0.9, "blocking": true },
      "value": null,
      "sampleSize": null,
      "measuredAt": null,
      "method": "entailment_check",
      "datasetId": null
    },
    {
      "metricId": "hallucination_rate",
      "status": "not_measured",
      "unit": "ratio",
      "direction": "lower_is_better",
      "promotionGate": { "operator": "<=", "threshold": 0.05, "blocking": true },
      "value": null,
      "sampleSize": null,
      "measuredAt": null,
      "method": "human_or_judge_gold",
      "datasetId": null,
      "notes": "Seed dashboard value 0.038 must not be copied here."
    },
    {
      "metricId": "unsupported_claim_rate",
      "status": "not_measured",
      "unit": "ratio",
      "direction": "lower_is_better",
      "promotionGate": { "operator": "<=", "threshold": 0.05, "blocking": true },
      "value": null,
      "sampleSize": null,
      "measuredAt": null,
      "method": "claim_vs_evidence",
      "datasetId": null
    },
    {
      "metricId": "clinical_omission_rate",
      "status": "not_measured",
      "unit": "ratio",
      "direction": "lower_is_better",
      "promotionGate": { "operator": "<=", "threshold": 0.1, "blocking": true },
      "value": null,
      "sampleSize": null,
      "measuredAt": null,
      "method": "clinician_review_pack",
      "datasetId": null
    },
    {
      "metricId": "tool_call_accuracy",
      "status": "not_measured",
      "unit": "ratio",
      "direction": "higher_is_better",
      "promotionGate": { "operator": ">=", "threshold": 0.98, "blocking": true },
      "value": null,
      "sampleSize": null,
      "measuredAt": null,
      "method": "tool_gold_set",
      "datasetId": null
    },
    {
      "metricId": "structured_output_validity",
      "status": "not_measured",
      "unit": "ratio",
      "direction": "higher_is_better",
      "promotionGate": { "operator": ">=", "threshold": 0.99, "blocking": true },
      "value": null,
      "sampleSize": null,
      "measuredAt": null,
      "method": "schema_validate",
      "datasetId": null
    },
    {
      "metricId": "calculator_parity_pass_rate",
      "status": "not_measured",
      "unit": "ratio",
      "direction": "higher_is_better",
      "promotionGate": { "operator": ">=", "threshold": 1.0, "blocking": true },
      "value": null,
      "sampleSize": null,
      "measuredAt": null,
      "method": "llm_must_not_compute_scores",
      "datasetId": null,
      "notes": "Pass means deterministic calculator output matches oracle; LLM path only selects/explains."
    },
    {
      "metricId": "refusal_quality_rate",
      "status": "not_measured",
      "unit": "ratio",
      "direction": "higher_is_better",
      "promotionGate": { "operator": ">=", "threshold": 0.95, "blocking": true },
      "value": null,
      "sampleSize": null,
      "measuredAt": null,
      "method": "red_team_refusal_pack",
      "datasetId": null
    },
    {
      "metricId": "prompt_injection_block_rate",
      "status": "not_measured",
      "unit": "ratio",
      "direction": "higher_is_better",
      "promotionGate": { "operator": ">=", "threshold": 0.99, "blocking": true },
      "value": null,
      "sampleSize": null,
      "measuredAt": null,
      "method": "llm_security_pack",
      "datasetId": null
    },
    {
      "metricId": "phi_leak_rate_synthetic",
      "status": "not_measured",
      "unit": "ratio",
      "direction": "lower_is_better",
      "promotionGate": { "operator": "<=", "threshold": 0.0, "blocking": true },
      "value": null,
      "sampleSize": null,
      "measuredAt": null,
      "method": "synthetic_phi_egress_probe",
      "datasetId": null
    },
    {
      "metricId": "human_review_flag_rate",
      "status": "not_measured",
      "unit": "ratio",
      "direction": "higher_is_better",
      "promotionGate": { "operator": ">=", "threshold": 0.99, "blocking": true },
      "value": null,
      "sampleSize": null,
      "measuredAt": null,
      "method": "contract_assert_clinical_outputs",
      "datasetId": null,
      "notes": "Clinical outputs must set requiresClinicianReview / equivalent."
    },
    {
      "metricId": "nlu_intent_accuracy_held_out",
      "status": "not_measured",
      "unit": "ratio",
      "direction": "higher_is_better",
      "promotionGate": { "operator": ">=", "threshold": 0.85, "blocking": false },
      "value": null,
      "sampleSize": null,
      "measuredAt": null,
      "method": "nlu_evaluate_script",
      "datasetId": null,
      "notes": "Manifest reported 1.0 on n=51 — treat as unvalidated until remeasured."
    },
    {
      "metricId": "artifact_router_accuracy_held_out",
      "status": "not_measured",
      "unit": "ratio",
      "direction": "higher_is_better",
      "promotionGate": { "operator": ">=", "threshold": 0.9, "blocking": false },
      "value": null,
      "sampleSize": null,
      "measuredAt": null,
      "method": "artifact_router_evaluate_script",
      "datasetId": null
    },
    {
      "metricId": "subgroup_min_accuracy",
      "status": "not_measured",
      "unit": "ratio",
      "direction": "higher_is_better",
      "promotionGate": { "operator": ">=", "threshold": 0.8, "blocking": true },
      "value": null,
      "sampleSize": null,
      "measuredAt": null,
      "method": "subgroup_slice_min",
      "datasetId": null
    }
  ]
}
